[
  {
    "id": "2025-balance-wheel-leg-csdn-single-bridge",
    "title": "平衡轮腿组之可达鸭思路浅析：单边桥控制",
    "url": "https://blog.csdn.net/zhuoqingjoking97298/article/details/146122467",
    "year": "2025",
    "groups": [
      "balance-wheel-leg"
    ],
    "type": "csdn",
    "topics": [
      "control",
      "mechanical",
      "case-study"
    ],
    "level": "intermediate",
    "language": "zh-CN",
    "description": "面向智能车平衡轮腿组的单边桥控制思路文章，适合整理轮腿姿态、过桥动作和控制策略时参考。",
    "source": {
      "platform": "csdn",
      "author": "可达鸭"
    },
    "tags": [
      "平衡轮腿",
      "单边桥",
      "控制策略",
      "第20届"
    ],
    "featured": true,
    "createdAt": "2026-05-27",
    "updatedAt": "2026-05-27"
  },
  {
    "id": "2025-balance-wheel-leg-bilibili-seekfree-early-run",
    "title": "第20届平衡轮腿组浅跑测试视频",
    "url": "https://www.bilibili.com/video/BV17rNxezEmv/",
    "year": "2025",
    "groups": [
      "balance-wheel-leg"
    ],
    "type": "bilibili",
    "topics": [
      "control",
      "mechanical",
      "case-study"
    ],
    "level": "beginner",
    "language": "zh-CN",
    "description": "逐飞科技发布的平衡轮腿组演示车模浅跑测试视频，可直观看到前期性能验证和车模基本运动状态。",
    "source": {
      "platform": "bilibili",
      "author": "逐飞科技"
    },
    "tags": [
      "浅跑测试",
      "逐飞科技",
      "演示车模",
      "视频"
    ],
    "featured": false,
    "createdAt": "2026-06-06",
    "updatedAt": "2026-06-06"
  },
  {
    "id": "2025-balance-wheel-leg-bilibili-seekfree-demo-run",
    "title": "第20届平衡轮腿组演示车模运行演示视频",
    "url": "https://www.bilibili.com/video/BV1rv9yYKE6U/",
    "year": "2025",
    "groups": [
      "balance-wheel-leg"
    ],
    "type": "bilibili",
    "topics": [
      "control",
      "vision",
      "mechanical",
      "case-study"
    ],
    "level": "beginner",
    "language": "zh-CN",
    "description": "逐飞科技发布的第20届平衡轮腿组演示车模运行视频，展示轮腿车模循迹和整体运行效果。",
    "source": {
      "platform": "bilibili",
      "author": "逐飞科技"
    },
    "tags": [
      "运行演示",
      "逐飞科技",
      "演示车模",
      "视频"
    ],
    "featured": true,
    "createdAt": "2026-06-06",
    "updatedAt": "2026-06-06"
  },
  {
    "id": "2025-balance-wheel-leg-wechat-seekfree-early-validation",
    "title": "第20届平衡轮腿组逐飞演示车模前期验证",
    "url": "https://mp.weixin.qq.com/s/xtHcXiOZAAx4XmkLTlk8vQ",
    "year": "2025",
    "groups": [
      "balance-wheel-leg"
    ],
    "type": "wechat",
    "topics": [
      "control",
      "mechanical",
      "case-study"
    ],
    "level": "intermediate",
    "language": "zh-CN",
    "description": "逐飞科技平衡轮腿组演示车模前期验证文章，围绕性能验证和样车调试思路展开，适合早期方案参考。",
    "source": {
      "platform": "wechat",
      "author": "逐飞科技"
    },
    "tags": [
      "前期验证",
      "逐飞科技",
      "性能验证",
      "平衡轮腿"
    ],
    "featured": false,
    "createdAt": "2026-06-06",
    "updatedAt": "2026-06-06"
  },
  {
    "id": "2025-balance-wheel-leg-wechat-seekfree-demo-analysis",
    "title": "第20届智能车平衡轮腿组演示车模浅析",
    "url": "https://mp.weixin.qq.com/s/AwHOXOwt8G0TGqKKPaox1A",
    "year": "2025",
    "groups": [
      "balance-wheel-leg"
    ],
    "type": "wechat",
    "topics": [
      "control",
      "vision",
      "mechanical",
      "case-study"
    ],
    "level": "intermediate",
    "language": "zh-CN",
    "description": "逐飞科技平衡轮腿组演示车模浅析，关键词包括姿态解算、平衡控制和摄像头循迹，适合复现样车方案前阅读。",
    "source": {
      "platform": "wechat",
      "author": "逐飞科技"
    },
    "tags": [
      "姿态解算",
      "平衡控制",
      "摄像头循迹",
      "逐飞科技"
    ],
    "featured": true,
    "createdAt": "2026-06-06",
    "updatedAt": "2026-06-06"
  },
  {
    "id": "2025-balance-wheel-leg-infineon-seekfree-live",
    "title": "第二十届智能车竞赛英飞凌逐飞联合直播平衡轮腿组专题分享",
    "url": "https://www.eet-china.com/mp/a385785.html",
    "year": "2025",
    "groups": [
      "balance-wheel-leg"
    ],
    "type": "article",
    "topics": [
      "embedded",
      "hardware",
      "control",
      "mechanical"
    ],
    "level": "intermediate",
    "language": "zh-CN",
    "description": "英飞凌与逐飞联合直播的平衡轮腿组专题分享，覆盖英飞凌MCU、无刷驱动、V车控制、跳跃和单边桥等内容。",
    "source": {
      "platform": "eet-china",
      "author": "TsinghuaJoking"
    },
    "tags": [
      "英飞凌",
      "逐飞科技",
      "专题直播",
      "无刷驱动"
    ],
    "featured": true,
    "createdAt": "2026-06-06",
    "updatedAt": "2026-06-06"
  },
  {
    "id": "2025-balance-wheel-leg-csdn-keduck-lqr",
    "title": "第20届平衡轮腿组可达鸭思路浅析：LQR控制建模",
    "url": "https://blog.csdn.net/zhuoqingjoking97298/article/details/146120519",
    "year": "2025",
    "groups": [
      "balance-wheel-leg"
    ],
    "type": "csdn",
    "topics": [
      "control",
      "simulation",
      "mechanical",
      "case-study"
    ],
    "level": "advanced",
    "language": "zh-CN",
    "description": "可达鸭平衡轮腿组备赛思路文章，重点介绍LQR控制、车轮与车体建模、状态空间表达和演示车模运行思路。",
    "source": {
      "platform": "csdn",
      "author": "卓晴"
    },
    "tags": [
      "可达鸭",
      "LQR",
      "建模",
      "平衡控制"
    ],
    "featured": true,
    "createdAt": "2026-06-06",
    "updatedAt": "2026-06-06"
  },
  {
    "id": "2025-balance-wheel-leg-csdn-keduck-jump",
    "title": "平衡轮腿组之可达鸭思路浅析：跳跃浅析",
    "url": "https://blog.csdn.net/zhuoqingjoking97298/article/details/146122256",
    "year": "2025",
    "groups": [
      "balance-wheel-leg"
    ],
    "type": "csdn",
    "topics": [
      "control",
      "mechanical",
      "case-study"
    ],
    "level": "advanced",
    "language": "zh-CN",
    "description": "可达鸭围绕平衡轮腿组跳跃控制的思路文章，讨论起跳、空中姿态控制、离地判断和落地切换等关键问题。",
    "source": {
      "platform": "csdn",
      "author": "卓晴"
    },
    "tags": [
      "可达鸭",
      "跳跃控制",
      "空中姿态",
      "轮腿控制"
    ],
    "featured": true,
    "createdAt": "2026-06-06",
    "updatedAt": "2026-06-06"
  },
  {
    "id": "2025-balance-wheel-leg-open-hardware-cyt2bl3-foc",
    "title": "CYT2BL3双路有感FOC驱动开源硬件",
    "url": "https://oshwhub.com/202-0202/zhi-neng-che-foc-qu-dong-jian-rong-zhu-fei-ku",
    "year": "2025",
    "groups": [
      "balance-wheel-leg"
    ],
    "type": "open-hardware",
    "topics": [
      "hardware",
      "embedded",
      "open-hardware"
    ],
    "level": "intermediate",
    "language": "zh-CN",
    "description": "立创开源硬件上的CYT2BL3双路有感FOC驱动板，说明可用于第20届轮腿组比赛的无刷驱动方案。",
    "source": {
      "platform": "oshwhub",
      "author": "kepler1072"
    },
    "tags": [
      "CYT2BL3",
      "FOC",
      "无刷驱动",
      "立创开源"
    ],
    "featured": true,
    "createdAt": "2026-06-06",
    "updatedAt": "2026-06-06"
  },
  {
    "id": "2025-balance-wheel-leg-open-hardware-national-second",
    "title": "第20届大学生智能汽车竞赛平衡轮腿组国二开源硬件",
    "url": "https://oshwhub.com/photoelectric-giant/zhi-neng-che-di-liu-ban-_2025-07-26",
    "year": "2025",
    "groups": [
      "balance-wheel-leg"
    ],
    "type": "open-hardware",
    "topics": [
      "hardware",
      "mechanical",
      "open-hardware",
      "case-study"
    ],
    "level": "advanced",
    "language": "zh-CN",
    "description": "立创开源硬件上的第20届平衡轮腿组国二项目，公开整车硬件方案描述并记录FOC驱动与分线板等实践问题。",
    "source": {
      "platform": "oshwhub",
      "author": "photoelectric-giant"
    },
    "tags": [
      "国二方案",
      "开源硬件",
      "TC264",
      "FOC"
    ],
    "featured": true,
    "createdAt": "2026-06-06",
    "updatedAt": "2026-06-06"
  },
  {
    "id": "2025-balance-wheel-leg-csdn-finals-interview",
    "title": "第二十届全国大学生智能汽车竞赛总决赛英飞凌平衡轮腿组现场采访",
    "url": "https://blog.csdn.net/zhuoqingjoking97298/article/details/152090858",
    "year": "2025",
    "groups": [
      "balance-wheel-leg"
    ],
    "type": "csdn",
    "topics": [
      "case-study",
      "control",
      "hardware",
      "mechanical"
    ],
    "level": "intermediate",
    "language": "zh-CN",
    "description": "第20届总决赛平衡轮腿组现场采访整理，汇总多支队伍的MCU选型、控制方案、单边桥与跳跃难点经验。",
    "source": {
      "platform": "csdn",
      "author": "卓晴"
    },
    "tags": [
      "总决赛采访",
      "经验复盘",
      "TC264",
      "控制方案"
    ],
    "featured": true,
    "createdAt": "2026-06-06",
    "updatedAt": "2026-06-06"
  }
]
