[
  {
    "id": "2026-official-rules-common",
    "title": "2026 年智能车竞赛规则与通知汇总",
    "url": "https://smartcar.cdstm.cn/",
    "year": "2026",
    "groups": ["common"],
    "type": "official",
    "topics": ["rules"],
    "level": "beginner",
    "language": "zh-CN",
    "description": "官方赛事信息入口示例，适合作为规则、通知和赛题资料的聚合来源。",
    "source": {
      "platform": "official",
      "author": "全国大学生智能车竞赛"
    },
    "tags": ["官方", "规则", "通知"],
    "featured": true,
    "createdAt": "2026-05-27",
    "updatedAt": "2026-05-27"
  },
  {
    "id": "2025-github-camera-baseline",
    "title": "摄像头组基础代码仓库示例",
    "url": "https://github.com/example/smartcar-camera-baseline",
    "year": "2025",
    "groups": ["camera"],
    "type": "github",
    "topics": ["embedded", "vision", "control"],
    "level": "intermediate",
    "language": "zh-CN",
    "description": "用于演示 GitHub 开源仓库类资源的数据结构，覆盖图像采集、赛道识别和基础控制。",
    "source": {
      "platform": "github",
      "author": "示例作者"
    },
    "tags": ["摄像头", "代码", "PID"],
    "featured": false,
    "createdAt": "2026-05-27",
    "updatedAt": "2026-05-27"
  },
  {
    "id": "2024-bilibili-electromagnetic-debug",
    "title": "电磁组调车与传感器标定视频示例",
    "url": "https://www.bilibili.com/video/BV1xx411c7mD/",
    "year": "2024",
    "groups": ["electromagnetic"],
    "type": "bilibili",
    "topics": ["electromagnetic", "hardware", "control"],
    "level": "beginner",
    "language": "zh-CN",
    "description": "用于演示 B 站视频类资源的数据结构，内容聚焦电磁传感器布置、标定和调参思路。",
    "source": {
      "platform": "bilibili",
      "author": "示例 UP 主"
    },
    "tags": ["电磁", "调参", "传感器"],
    "featured": true,
    "createdAt": "2026-05-27",
    "updatedAt": "2026-05-27"
  },
  {
    "id": "2025-article-common-pid-intro",
    "title": "智能车 PID 控制入门文章示例",
    "url": "https://example.com/smartcar-pid-intro",
    "year": "2025",
    "groups": ["common", "camera", "electromagnetic"],
    "type": "article",
    "topics": ["control", "embedded"],
    "level": "beginner",
    "language": "zh-CN",
    "description": "用于演示文章教程类资源的数据结构，适合作为控制算法筛选页的入门材料。",
    "source": {
      "platform": "website",
      "author": "示例作者"
    },
    "tags": ["PID", "控制", "入门"],
    "featured": false,
    "createdAt": "2026-05-27",
    "updatedAt": "2026-05-27"
  }
]
